
liftoverSV 0.3.0_beta
Copyright (C) 2024-current GEOFFROY Veronique
Please feel free to create a Github issue for any suggestions or bug reports
https://github.com/lgmgeo/liftoverSV/issues


Python version: 3.8.13 

Application name used:
/WORKING_DIRECTORY/vgeoffroy/liftoverSV/liftoverSV_dev 


[12:34:14] Listing arguments
           *********************************************
           liftoverSV has been run with these arguments:
           *********************************************
           --chain /PUBLIC_DATA/ReferenceGenomes/Liftover_Chain_Files/hg19ToHg38.over.chain
           --chunk-size 50000
           --input-file ./input/input_hg19.vcf.gz
           --n-workers 8
           --output-base-name ./output/output_hg38
           --output-dir ./output
           --output-file ./output/output_hg38.sort.vcf.gz
           --percent 0.05
           --ref-fasta-seq /PUBLIC_DATA/ReferenceGenomes/UCSChg38/hg38.fa
           --verbose False
           *********************************************
[12:34:14] Ensuring that the input VCF contains only biallelic variants
[12:34:14] Checking the ref_fasta_seq file
[12:34:14] Loading the size of the chromosomes of the target build
           (parsing hg19ToHg38.over.chain)
[12:34:15] Initializing a temporary VCF output file for unsorted mapped variants
           /tmp/tmpknj_ywi4.liftoverSV.tmp.vcf
[12:34:15] Initializing the output unmapped file
           ./output/output_hg38.unmapped
[12:34:15] Reading input VCF: ./input/input_hg19.vcf.gz
[12:34:15] Lift over SV:
           Writing to /tmp/tmpknj_ywi4.liftoverSV.tmp.vcf
           Writing to ./output/output_hg38.unmapped
[12:34:15] Processing 1 chunks (target chunk size: 50000 lines)
[12:34:15] Liftover summary:
           * 1 mapped SV
           * 0 unmapped SV
[12:34:15] Writing header in the ./output/output_hg38.sort.vcf.gz
           => Updating (if needed) the INFO, FORMAT and FILTER header lines
           => Updating (if needed) the contigs header lines
           => Adding information about the use of liftoverSV
           => Adding/Updating the reference header line
[12:34:15] Sorting and compressing the VCF output file
           => Reading VCF to sort: /tmp/tmpknj_ywi4.liftoverSV.tmp.vcf
           => Writing ./output/output_hg38.sort.vcf.gz
[12:34:15] Removing /tmp/tmpknj_ywi4.liftoverSV.tmp.vcf
[12:34:15] Liftover completed successfully.

liftoverSV 0.3.0_beta
Copyright (C) 2024-current GEOFFROY Veronique
Please feel free to create a Github issue for any suggestions or bug reports
https://github.com/lgmgeo/liftoverSV/issues


Python version: 3.8.13 

Application name used:
/WORKING_DIRECTORY/vgeoffroy/liftoverSV/liftoverSV_dev 


[12:34:15] Listing arguments
           *********************************************
           liftoverSV has been run with these arguments:
           *********************************************
           --chain /PUBLIC_DATA/ReferenceGenomes/Liftover_Chain_Files/hg19ToHg38.over.chain
           --chunk-size 50000
           --input-file ./input/input_hg19.vcf.gz
           --n-workers 8
           --output-base-name ./output/output_hg38
           --output-dir ./output
           --output-file ./output/output_hg38.sort.vcf.gz
           --percent 0.05
           --ref-fasta-seq /PUBLIC_DATA/ReferenceGenomes/UCSChg38/hg38.fa
           --verbose False
           *********************************************
[12:34:15] Ensuring that the input VCF contains only biallelic variants
[12:34:16] Checking the ref_fasta_seq file
[12:34:16] Loading the size of the chromosomes of the target build
           (parsing hg19ToHg38.over.chain)
[12:34:16] Initializing a temporary VCF output file for unsorted mapped variants
           /tmp/tmphszble9n.liftoverSV.tmp.vcf
[12:34:16] Initializing the output unmapped file
           ./output/output_hg38.unmapped
[12:34:16] Reading input VCF: ./input/input_hg19.vcf.gz
[12:34:16] Lift over SV:
           Writing to /tmp/tmphszble9n.liftoverSV.tmp.vcf
           Writing to ./output/output_hg38.unmapped
[12:34:16] Processing 1 chunks (target chunk size: 50000 lines)
[12:34:16] Liftover summary:
           * 1 mapped SV
           * 0 unmapped SV
[12:34:16] Writing header in the ./output/output_hg38.sort.vcf.gz
           => Updating (if needed) the INFO, FORMAT and FILTER header lines
           => Updating (if needed) the contigs header lines
           => Adding information about the use of liftoverSV
           => Adding/Updating the reference header line
[12:34:16] Sorting and compressing the VCF output file
           => Reading VCF to sort: /tmp/tmphszble9n.liftoverSV.tmp.vcf
           => Writing ./output/output_hg38.sort.vcf.gz
[12:34:16] Removing /tmp/tmphszble9n.liftoverSV.tmp.vcf
[12:34:16] Liftover completed successfully.

liftoverSV 0.3.0_beta
Copyright (C) 2024-current GEOFFROY Veronique
Please feel free to create a Github issue for any suggestions or bug reports
https://github.com/lgmgeo/liftoverSV/issues


Python version: 3.8.13 

Application name used:
/WORKING_DIRECTORY/vgeoffroy/liftoverSV/liftoverSV_dev 


[12:34:17] Listing arguments
           *********************************************
           liftoverSV has been run with these arguments:
           *********************************************
           --chain /PUBLIC_DATA/ReferenceGenomes/Liftover_Chain_Files/hg19ToHg38.over.chain
           --chunk-size 50000
           --input-file ./input/input_hg19.vcf.gz
           --n-workers 8
           --output-base-name ./output/output_hg38
           --output-dir ./output
           --output-file ./output/output_hg38.sort.vcf.gz
           --percent 0.05
           --ref-fasta-seq /PUBLIC_DATA/ReferenceGenomes/UCSChg38/hg38.fa
           --verbose False
           *********************************************
[12:34:17] Ensuring that the input VCF contains only biallelic variants
[12:34:17] Checking the ref_fasta_seq file
[12:34:17] Loading the size of the chromosomes of the target build
           (parsing hg19ToHg38.over.chain)
[12:34:17] Initializing a temporary VCF output file for unsorted mapped variants
           /tmp/tmprvzpuye4.liftoverSV.tmp.vcf
[12:34:17] Initializing the output unmapped file
           ./output/output_hg38.unmapped
[12:34:17] Reading input VCF: ./input/input_hg19.vcf.gz
[12:34:17] Lift over SV:
           Writing to /tmp/tmprvzpuye4.liftoverSV.tmp.vcf
           Writing to ./output/output_hg38.unmapped
[12:34:17] Processing 1 chunks (target chunk size: 50000 lines)
[12:34:17] Liftover summary:
           * 1 mapped SV
           * 0 unmapped SV
[12:34:17] Writing header in the ./output/output_hg38.sort.vcf.gz
           => Updating (if needed) the INFO, FORMAT and FILTER header lines
           => Updating (if needed) the contigs header lines
           => Adding information about the use of liftoverSV
           => Adding/Updating the reference header line
[12:34:17] Sorting and compressing the VCF output file
           => Reading VCF to sort: /tmp/tmprvzpuye4.liftoverSV.tmp.vcf
           => Writing ./output/output_hg38.sort.vcf.gz
[12:34:17] Removing /tmp/tmprvzpuye4.liftoverSV.tmp.vcf
[12:34:17] Liftover completed successfully.
ok - Finished
